{
  "$schema": "./schema/project-metadata.schema.json",
  "project_key": "kisho-contracts",
  "display_name": "Kisho System Contracts",
  "product_line": "contracts",
  "lifecycle_status": "production",
  "governance_status": "green",
  "github_repo_url": "https://github.com/juliushsu/kisho-system-contracts.git",
  "default_branch": "main",
  "docs_path": "docs",
  "migration_path": null,
  "frontend_path": null,
  "backend_path": null,
  "supabase_project_alias": null,
  "railway_service_alias": null,
  "environments": [
    {
      "name": "local",
      "frontend_url": null,
      "backend_url": null,
      "supabase_alias": null,
      "railway_alias": null,
      "status": "available"
    },
    {
      "name": "production",
      "frontend_url": "https://github.com/juliushsu/kisho-system-contracts",
      "backend_url": null,
      "supabase_alias": null,
      "railway_alias": null,
      "status": "available"
    }
  ],
  "owner": "platform_owner",
  "maintainers": [
    "platform_owner"
  ],
  "last_verified_at": "2026-05-12",
  "notes": "Public-safe contracts repository for system contracts, decisions, and project metadata registry.",
  "prohibited_secret_fields": [
    "api_key",
    "token",
    "password",
    "service_role_key",
    "anon_key_from_env",
    "jwt",
    "private_key",
    "database_url",
    "connection_string",
    "webhook_secret",
    "signed_url",
    "env_value",
    "railway_token",
    "cloud_provider_credential"
  ]
}
